ALTER DATABASE contrib_regression SET pgcrypto.fips TO on;
ERROR:  FIPS enabled OpenSSL is required for strict FIPS mode (openssl.c:1055)
HINT:  Recompile OpenSSL with the FIPS module, or install a FIPS enabled OpenSSL distribution.
\c contrib_regression
SHOW pgcrypto.fips;
 pgcrypto.fips 
---------------
 off
(1 row)

CREATE TABLE fipstest (data text, res text, salt text);
NOTICE:  Table doesn't have 'DISTRIBUTED BY' clause -- Using column named 'data' as the Greenplum Database data distribution key for this table.
HINT:  The 'DISTRIBUTED BY' clause determines the distribution of data. Make sure column(s) chosen are the optimal data distribution key to minimize skew.
INSERT INTO fipstest VALUES ('password', '', '');
SELECT 'Test digest md5: EXPECTED ERROR FAIL FIPS' as comment;
                  comment                  
-------------------------------------------
 Test digest md5: EXPECTED ERROR FAIL FIPS
(1 row)

SELECT digest('santa claus', 'md5');
               digest               
------------------------------------
 \x7c4f44266cee2dbfacaa009ef5e167dc
(1 row)

SELECT 'Test digest sha256: EXPECTED PASS' as comment;
              comment              
-----------------------------------
 Test digest sha256: EXPECTED PASS
(1 row)

SELECT digest('santa claus', 'sha256');
                               digest                               
--------------------------------------------------------------------
 \x675b8f61fc27140b5f06fec4613d8b3d9b913a82074d4c790374558c18d2cb7d
(1 row)

SELECT 'Test hmac md5: EXPECTED ERROR FAIL FIPS' as comment;
                 comment                 
-----------------------------------------
 Test hmac md5: EXPECTED ERROR FAIL FIPS
(1 row)

SELECT hmac('santa claus', 'aaa', 'md5');
                hmac                
------------------------------------
 \xd13b4c8c8a6e9d6236e8cc0b141968c5
(1 row)

SELECT 'Test hmac sha256: EXPECTED PASS' as comment;
             comment             
---------------------------------
 Test hmac sha256: EXPECTED PASS
(1 row)

SELECT hmac('santa claus', 'aaa', 'sha256');
                                hmac                                
--------------------------------------------------------------------
 \xc88fe8ff0541b1bb25abd971fa7642d256a1c0109f7e56875d593a3daaeacf54
(1 row)

SELECT 'Test gen_salt : EXPECTED FAIL FIPS' as comment;
              comment               
------------------------------------
 Test gen_salt : EXPECTED FAIL FIPS
(1 row)

UPDATE fipstest SET salt = gen_salt('md5');
SELECT 'Test crypt : EXPECTED FAIL FIPS' as comment;
             comment             
---------------------------------
 Test crypt : EXPECTED FAIL FIPS
(1 row)

UPDATE fipstest SET res = crypt(data, salt);
SELECT res = crypt(data, res) AS "worked" FROM fipstest;
 worked 
--------
 t
(1 row)

SELECT 'Test pgp : EXPECTED PASS' as comment;
         comment          
--------------------------
 Test pgp : EXPECTED PASS
(1 row)

select pgp_sym_decrypt(pgp_sym_encrypt('santa clause', 'mypass', 'cipher-algo=aes256'), 'mypass');
 pgp_sym_decrypt 
-----------------
 santa clause
(1 row)

SELECT 'Test pgp : EXPECTED FAIL FIPS' as comment;
            comment            
-------------------------------
 Test pgp : EXPECTED FAIL FIPS
(1 row)

select pgp_sym_decrypt(pgp_sym_encrypt('santa clause', 'mypass', 'cipher-algo=bf'), 'mypass');
 pgp_sym_decrypt 
-----------------
 santa clause
(1 row)

SELECT 'Test raw encrypt : EXPECTED PASS' as comment;
             comment              
----------------------------------
 Test raw encrypt : EXPECTED PASS
(1 row)

SELECT encrypt('santa claus', 'mypass', 'aes') as raw_aes;
              raw_aes               
------------------------------------
 \xe7ac3ad57bde59c5b78c08805afdb774
(1 row)

DROP TABLE fipstest;
