-- Test CLUSTER with append optimized storage
CREATE TABLE cluster_ao_table(
	id int,
	fname text,
	lname text,
	address1 text,
	address2 text,
	city text,
	state text,
	zip text)
WITH (appendonly=true)
DISTRIBUTED BY (id);
INSERT INTO cluster_ao_table (id, fname, lname, address1, address2, city, state, zip)
SELECT i, 'Jon_' || i, 'Roberts_' || i, i || ' Main Street', 'Apartment ' || i, 'New York', 'NY', i::text
FROM generate_series(1, 10000) AS i;
CREATE INDEX ON cluster_ao_table (id);
BEGIN;
CLUSTER cluster_ao_table USING cluster_ao_table_id_idx;
ABORT;
CLUSTER cluster_ao_table USING cluster_ao_table_id_idx;
SELECT * FROM cluster_ao_table WHERE id = 10;
 id | fname  |   lname    |    address1    |   address2   |   city   | state | zip 
----+--------+------------+----------------+--------------+----------+-------+-----
 10 | Jon_10 | Roberts_10 | 10 Main Street | Apartment 10 | New York | NY    | 10
(1 row)

DROP TABLE cluster_ao_table;
-- Test CLUSTER with append optimized columnar storage
CREATE TABLE cluster_ao_table(
	id int,
	fname text,
	lname text,
	address1 text,
	address2 text,
	city text,
	state text,
	zip text)
WITH (appendonly=true, orientation=column)
DISTRIBUTED BY (id);
INSERT INTO cluster_ao_table (id, fname, lname, address1, address2, city, state, zip)
SELECT i, 'Jon_' || i, 'Roberts_' || i, i || ' Main Street', 'Apartment ' || i, 'New York', 'NY', i::text
FROM generate_series(1, 10000) AS i;
CREATE INDEX ON cluster_ao_table (id);
BEGIN;
CLUSTER cluster_ao_table USING cluster_ao_table_id_idx;
ABORT;
CLUSTER cluster_ao_table USING cluster_ao_table_id_idx;
SELECT * FROM cluster_ao_table WHERE id = 10;
 id | fname  |   lname    |    address1    |   address2   |   city   | state | zip 
----+--------+------------+----------------+--------------+----------+-------+-----
 10 | Jon_10 | Roberts_10 | 10 Main Street | Apartment 10 | New York | NY    | 10
(1 row)

DROP TABLE cluster_ao_table;
-- Test transactional safety of CLUSTER against heap
CREATE TABLE cluster_foo (a int, b varchar, c int) DISTRIBUTED BY (a);
INSERT INTO cluster_foo SELECT i, 'initial insert' || i, i FROM generate_series(1,10000)i;
CREATE index cluster_ifoo on cluster_foo using btree (b);
-- execute cluster in a transaction but don't commit the transaction
BEGIN;
CLUSTER cluster_foo USING cluster_ifoo;
ABORT;
-- try cluster again
CLUSTER cluster_foo USING cluster_ifoo;
DROP TABLE cluster_foo;
-- Test that reltuples and relpages are populated on both QE and QD post-CLUSTER.
-- This test is for heap tables.
CREATE TABLE cluster_stats_heap(a int, b int);
NOTICE:  Table doesn't have 'DISTRIBUTED BY' clause -- Using column named 'a' as the Greenplum Database data distribution key for this table.
HINT:  The 'DISTRIBUTED BY' clause determines the distribution of data. Make sure column(s) chosen are the optimal data distribution key to minimize skew.
CREATE INDEX ON cluster_stats_heap(a);
INSERT INTO cluster_stats_heap SELECT a, a FROM generate_series(1, 100)a;
ANALYZE cluster_stats_heap;
SELECT gp_segment_id, relpages, reltuples FROM gp_dist_random('pg_class')
WHERE relname='cluster_stats_heap'
UNION
SELECT -1, relpages, reltuples FROM pg_class
WHERE relname='cluster_stats_heap';
 gp_segment_id | relpages | reltuples 
---------------+----------+-----------
             1 |        1 |        37
            -1 |        3 |       100
             0 |        1 |        38
             2 |        1 |        25
(4 rows)

DELETE FROM cluster_stats_heap where a % 3 = 1;
CLUSTER cluster_stats_heap USING cluster_stats_heap_a_idx;
SELECT gp_segment_id, relpages, reltuples FROM gp_dist_random('pg_class')
WHERE relname='cluster_stats_heap'
UNION
SELECT -1, relpages, reltuples FROM pg_class
WHERE relname='cluster_stats_heap';
 gp_segment_id | relpages | reltuples 
---------------+----------+-----------
            -1 |        3 |        66
             0 |        1 |        27
             1 |        1 |        26
             2 |        1 |        13
(4 rows)

-- This test is for ao_row tables.
CREATE TABLE cluster_stats_ao_row(a int, b int);
NOTICE:  Table doesn't have 'DISTRIBUTED BY' clause -- Using column named 'a' as the Greenplum Database data distribution key for this table.
HINT:  The 'DISTRIBUTED BY' clause determines the distribution of data. Make sure column(s) chosen are the optimal data distribution key to minimize skew.
CREATE INDEX ON cluster_stats_ao_row(a);
INSERT INTO cluster_stats_ao_row SELECT a, a FROM generate_series(1, 100)a;
ANALYZE cluster_stats_ao_row;
SELECT gp_segment_id, relpages, reltuples FROM gp_dist_random('pg_class')
WHERE relname='cluster_stats_ao_row'
UNION
SELECT -1, relpages, reltuples FROM pg_class
WHERE relname='cluster_stats_ao_row';
 gp_segment_id | relpages | reltuples 
---------------+----------+-----------
             1 |        1 |        37
            -1 |        3 |       100
             2 |        1 |        25
             0 |        1 |        38
(4 rows)

DELETE FROM cluster_stats_ao_row where a % 3 = 1;
CLUSTER cluster_stats_ao_row USING cluster_stats_ao_row_a_idx;
SELECT gp_segment_id, relpages, reltuples FROM gp_dist_random('pg_class')
WHERE relname='cluster_stats_ao_row'
UNION
SELECT -1, relpages, reltuples FROM pg_class
WHERE relname='cluster_stats_ao_row';
 gp_segment_id | relpages | reltuples 
---------------+----------+-----------
            -1 |        3 |        66
             0 |        1 |        27
             1 |        1 |        26
             2 |        1 |        13
(4 rows)

-- This test is for ao_column tables.
CREATE TABLE cluster_stats_ao_column(a int, b int);
NOTICE:  Table doesn't have 'DISTRIBUTED BY' clause -- Using column named 'a' as the Greenplum Database data distribution key for this table.
HINT:  The 'DISTRIBUTED BY' clause determines the distribution of data. Make sure column(s) chosen are the optimal data distribution key to minimize skew.
CREATE INDEX ON cluster_stats_ao_column(a);
INSERT INTO cluster_stats_ao_column SELECT a, a FROM generate_series(1, 100)a;
ANALYZE cluster_stats_ao_column;
SELECT gp_segment_id, relpages, reltuples FROM gp_dist_random('pg_class')
WHERE relname='cluster_stats_ao_column'
UNION
SELECT -1, relpages, reltuples FROM pg_class
WHERE relname='cluster_stats_ao_column';
 gp_segment_id | relpages | reltuples 
---------------+----------+-----------
             1 |        1 |        37
            -1 |        3 |       100
             2 |        1 |        25
             0 |        1 |        38
(4 rows)

DELETE FROM cluster_stats_ao_column where a % 3 = 1;
CLUSTER cluster_stats_ao_column USING cluster_stats_ao_column_a_idx;
SELECT gp_segment_id, relpages, reltuples FROM gp_dist_random('pg_class')
WHERE relname='cluster_stats_ao_column'
UNION
SELECT -1, relpages, reltuples FROM pg_class
WHERE relname='cluster_stats_ao_column';
 gp_segment_id | relpages | reltuples 
---------------+----------+-----------
            -1 |        3 |        66
             0 |        1 |        27
             1 |        1 |        26
             2 |        1 |        13
(4 rows)

